{
  "$id": "https://garderobe.invalid/contracts/2026-10-01/ConversationPage.json",
  "title": "ConversationPage",
  "$schema": "https://json-schema.org/draft/2020-12/schema",
  "type": "object",
  "properties": {
    "schemaVersion": {
      "type": "string",
      "const": "2026-10-01"
    },
    "messages": {
      "type": "array",
      "items": {
        "type": "object",
        "properties": {
          "messageId": {
            "type": "string"
          },
          "clientTurnId": {
            "type": [
              "string",
              "null"
            ]
          },
          "role": {
            "type": "string",
            "enum": [
              "user",
              "assistant",
              "system"
            ]
          },
          "createdAt": {
            "type": "string",
            "format": "date-time",
            "pattern": "^(?:(?:\\d\\d[2468][048]|\\d\\d[13579][26]|\\d\\d0[48]|[02468][048]00|[13579][26]00)-02-29|\\d{4}-(?:(?:0[13578]|1[02])-(?:0[1-9]|[12]\\d|3[01])|(?:0[469]|11)-(?:0[1-9]|[12]\\d|30)|(?:02)-(?:0[1-9]|1\\d|2[0-8])))T(?:(?:[01]\\d|2[0-3]):[0-5]\\d:[0-5]\\d(?:\\.\\d+)?(?:Z|([+-](?:[01]\\d|2[0-3]):[0-5]\\d)))$"
          },
          "sourceChannel": {
            "type": "string"
          },
          "status": {
            "type": "string",
            "enum": [
              "complete",
              "streaming",
              "stopped",
              "failed"
            ]
          },
          "parts": {
            "type": "array",
            "items": {
              "oneOf": [
                {
                  "type": "object",
                  "properties": {
                    "type": {
                      "type": "string",
                      "const": "text"
                    },
                    "text": {
                      "type": "string"
                    }
                  },
                  "required": [
                    "type",
                    "text"
                  ],
                  "additionalProperties": false
                },
                {
                  "type": "object",
                  "properties": {
                    "type": {
                      "type": "string",
                      "const": "outfit_card"
                    },
                    "boardId": {
                      "anyOf": [
                        {
                          "type": "string",
                          "minLength": 3,
                          "maxLength": 80,
                          "pattern": "^[a-z]{1,6}_[A-Za-z0-9_-]+$"
                        },
                        {
                          "type": "null"
                        }
                      ]
                    },
                    "optionId": {
                      "anyOf": [
                        {
                          "type": "string",
                          "minLength": 3,
                          "maxLength": 80,
                          "pattern": "^[a-z]{1,6}_[A-Za-z0-9_-]+$"
                        },
                        {
                          "type": "null"
                        }
                      ]
                    },
                    "boardRevision": {
                      "anyOf": [
                        {
                          "type": "integer",
                          "exclusiveMinimum": 0,
                          "maximum": 9007199254740991
                        },
                        {
                          "type": "null"
                        }
                      ]
                    },
                    "garmentIds": {
                      "type": "array",
                      "items": {
                        "type": "string",
                        "minLength": 3,
                        "maxLength": 80,
                        "pattern": "^[a-z]{1,6}_[A-Za-z0-9_-]+$"
                      }
                    },
                    "explanation": {
                      "type": "string"
                    },
                    "validated": {
                      "type": "boolean"
                    }
                  },
                  "required": [
                    "type",
                    "boardId",
                    "optionId",
                    "boardRevision",
                    "garmentIds",
                    "explanation",
                    "validated"
                  ],
                  "additionalProperties": false
                },
                {
                  "type": "object",
                  "properties": {
                    "type": {
                      "type": "string",
                      "const": "sources"
                    },
                    "sources": {
                      "type": "array",
                      "items": {
                        "type": "object",
                        "properties": {
                          "title": {
                            "type": "string"
                          },
                          "url": {
                            "type": "string"
                          },
                          "checkedAt": {
                            "anyOf": [
                              {
                                "type": "string",
                                "format": "date-time",
                                "pattern": "^(?:(?:\\d\\d[2468][048]|\\d\\d[13579][26]|\\d\\d0[48]|[02468][048]00|[13579][26]00)-02-29|\\d{4}-(?:(?:0[13578]|1[02])-(?:0[1-9]|[12]\\d|3[01])|(?:0[469]|11)-(?:0[1-9]|[12]\\d|30)|(?:02)-(?:0[1-9]|1\\d|2[0-8])))T(?:(?:[01]\\d|2[0-3]):[0-5]\\d:[0-5]\\d(?:\\.\\d+)?(?:Z|([+-](?:[01]\\d|2[0-3]):[0-5]\\d)))$"
                              },
                              {
                                "type": "null"
                              }
                            ]
                          }
                        },
                        "required": [
                          "title",
                          "url",
                          "checkedAt"
                        ],
                        "additionalProperties": false
                      }
                    }
                  },
                  "required": [
                    "type",
                    "sources"
                  ],
                  "additionalProperties": false
                },
                {
                  "type": "object",
                  "properties": {
                    "type": {
                      "type": "string",
                      "const": "receipt"
                    },
                    "commandId": {
                      "type": "string",
                      "minLength": 3,
                      "maxLength": 80,
                      "pattern": "^[a-z]{1,6}_[A-Za-z0-9_-]+$"
                    },
                    "summary": {
                      "type": "string"
                    }
                  },
                  "required": [
                    "type",
                    "commandId",
                    "summary"
                  ],
                  "additionalProperties": false
                },
                {
                  "type": "object",
                  "properties": {
                    "type": {
                      "type": "string",
                      "const": "reference"
                    },
                    "reference": {
                      "oneOf": [
                        {
                          "type": "object",
                          "properties": {
                            "kind": {
                              "type": "string",
                              "const": "garment"
                            },
                            "garmentId": {
                              "type": "string",
                              "minLength": 3,
                              "maxLength": 80,
                              "pattern": "^[a-z]{1,6}_[A-Za-z0-9_-]+$"
                            }
                          },
                          "required": [
                            "kind",
                            "garmentId"
                          ],
                          "additionalProperties": false
                        },
                        {
                          "type": "object",
                          "properties": {
                            "kind": {
                              "type": "string",
                              "const": "option"
                            },
                            "boardId": {
                              "type": "string",
                              "minLength": 3,
                              "maxLength": 80,
                              "pattern": "^[a-z]{1,6}_[A-Za-z0-9_-]+$"
                            },
                            "optionId": {
                              "type": "string",
                              "minLength": 3,
                              "maxLength": 80,
                              "pattern": "^[a-z]{1,6}_[A-Za-z0-9_-]+$"
                            },
                            "boardRevision": {
                              "type": "integer",
                              "exclusiveMinimum": 0,
                              "maximum": 9007199254740991
                            }
                          },
                          "required": [
                            "kind",
                            "boardId",
                            "optionId",
                            "boardRevision"
                          ],
                          "additionalProperties": false
                        }
                      ]
                    }
                  },
                  "required": [
                    "type",
                    "reference"
                  ],
                  "additionalProperties": false
                },
                {
                  "type": "object",
                  "properties": {
                    "type": {
                      "type": "string",
                      "const": "attachment"
                    },
                    "uploadId": {
                      "type": "string",
                      "minLength": 3,
                      "maxLength": 80,
                      "pattern": "^[a-z]{1,6}_[A-Za-z0-9_-]+$"
                    },
                    "contentType": {
                      "type": "string"
                    },
                    "thumbnailUrl": {
                      "type": [
                        "string",
                        "null"
                      ]
                    }
                  },
                  "required": [
                    "type",
                    "uploadId",
                    "contentType",
                    "thumbnailUrl"
                  ],
                  "additionalProperties": false
                },
                {
                  "type": "object",
                  "properties": {
                    "type": {
                      "type": "string",
                      "const": "result_card"
                    },
                    "kind": {
                      "type": "string"
                    },
                    "title": {
                      "type": "string"
                    },
                    "summary": {
                      "type": "string"
                    },
                    "jobRef": {
                      "type": "string"
                    }
                  },
                  "required": [
                    "type",
                    "kind",
                    "title",
                    "summary",
                    "jobRef"
                  ],
                  "additionalProperties": false
                }
              ]
            }
          },
          "runId": {
            "anyOf": [
              {
                "type": "string",
                "minLength": 3,
                "maxLength": 80,
                "pattern": "^[a-z]{1,6}_[A-Za-z0-9_-]+$"
              },
              {
                "type": "null"
              }
            ]
          }
        },
        "required": [
          "messageId",
          "clientTurnId",
          "role",
          "createdAt",
          "sourceChannel",
          "status",
          "parts"
        ],
        "additionalProperties": false
      }
    },
    "before": {
      "type": [
        "string",
        "null"
      ]
    },
    "hasMore": {
      "type": "boolean"
    },
    "after": {
      "type": [
        "string",
        "null"
      ]
    },
    "activeRunId": {
      "anyOf": [
        {
          "type": "string",
          "minLength": 3,
          "maxLength": 80,
          "pattern": "^[a-z]{1,6}_[A-Za-z0-9_-]+$"
        },
        {
          "type": "null"
        }
      ]
    }
  },
  "required": [
    "schemaVersion",
    "messages",
    "before",
    "hasMore",
    "activeRunId"
  ],
  "additionalProperties": false
}
